{
  "$schema": "https://json-schema.org/draft/2020-12/schema",
  "$id": "https://mortal-os.com/schemas/s3-state-recovery-receipt.schema.json",
  "title": "MortalOS S3 state availability and recovery evidence receipt",
  "type": "object",
  "additionalProperties": false,
  "required": [
    "format",
    "stage",
    "status",
    "source_commit",
    "base_commit",
    "source_committed_at",
    "dependency_lock_digest",
    "protocol_versions",
    "state_versions",
    "state_package_versions",
    "recovery_policy",
    "limits",
    "commands",
    "environment",
    "seeds",
    "started_at",
    "completed_at",
    "results",
    "known_limitations",
    "failures",
    "artifact_digests",
    "review_snapshot"
  ],
  "properties": {
    "format": { "const": "mortalos-stage-receipt/2" },
    "stage": { "const": "S3" },
    "status": { "const": "PASS" },
    "source_commit": { "$ref": "#/$defs/commit" },
    "base_commit": { "$ref": "#/$defs/commit" },
    "source_committed_at": { "$ref": "#/$defs/timestamp" },
    "dependency_lock_digest": { "$ref": "#/$defs/digest" },
    "protocol_versions": {
      "type": "array",
      "prefixItems": [
        { "const": "mortalos/0" },
        { "const": "mortalos/1" }
      ],
      "minItems": 2,
      "maxItems": 2
    },
    "state_versions": {
      "type": "array",
      "prefixItems": [{ "const": "mortalos-state/1" }],
      "minItems": 1,
      "maxItems": 1
    },
    "state_package_versions": {
      "type": "array",
      "prefixItems": [
        { "const": "mortalos-state-package-input/1" },
        { "const": "mortalos-state-package-manifest/1" },
        { "const": "mortalos-state-package-receipt/1" },
        { "const": "mortalos-state-package-transition/1" }
      ],
      "minItems": 4,
      "maxItems": 4
    },
    "recovery_policy": { "const": "mortalos-state-recovery-policy/1" },
    "limits": {
      "type": "object",
      "additionalProperties": false,
      "required": [
        "chunk_bytes",
        "input_bytes",
        "manifest_bytes",
        "max_chunks",
        "receipt_bytes",
        "reference_resource_bytes",
        "resource_bytes",
        "sources",
        "inventory_entries_per_source"
      ],
      "properties": {
        "chunk_bytes": { "const": 65536 },
        "input_bytes": { "const": 4096 },
        "manifest_bytes": { "const": 32768 },
        "max_chunks": { "const": 64 },
        "receipt_bytes": { "const": 4096 },
        "reference_resource_bytes": { "const": 1048576 },
        "resource_bytes": { "const": 4194304 },
        "sources": { "const": 8 },
        "inventory_entries_per_source": { "const": 64 }
      }
    },
    "commands": {
      "type": "array",
      "minItems": 8,
      "maxItems": 8,
      "items": {
        "type": "object",
        "additionalProperties": false,
        "required": ["command", "status", "summary"],
        "properties": {
          "command": { "type": "string", "minLength": 1 },
          "status": { "const": "PASS" },
          "summary": { "type": "string", "minLength": 1 }
        }
      }
    },
    "environment": {
      "type": "object",
      "additionalProperties": false,
      "required": [
        "os",
        "architecture",
        "node",
        "npm",
        "python",
        "chromium",
        "wrangler",
        "timezone"
      ],
      "properties": {
        "os": { "const": "Windows" },
        "architecture": { "const": "x64" },
        "node": { "type": "string", "minLength": 1 },
        "npm": { "type": "string", "minLength": 1 },
        "python": { "type": "string", "minLength": 1 },
        "chromium": { "type": "string", "minLength": 1 },
        "wrangler": { "type": "string", "minLength": 1 },
        "timezone": { "const": "Asia/Seoul" }
      }
    },
    "seeds": {
      "type": "object",
      "additionalProperties": false,
      "required": [
        "state_recovery_schedule",
        "state_recovery_schedule_count",
        "property_corpus_count",
        "participant_schedule_count",
        "durable_handoff_trials",
        "durable_loss_trials_per_endpoint"
      ],
      "properties": {
        "state_recovery_schedule": { "const": 1395872307 },
        "state_recovery_schedule_count": { "const": 10000 },
        "property_corpus_count": { "const": 10000 },
        "participant_schedule_count": { "const": 10000 },
        "durable_handoff_trials": { "const": 100 },
        "durable_loss_trials_per_endpoint": { "const": 100 }
      }
    },
    "started_at": { "$ref": "#/$defs/timestamp" },
    "completed_at": { "$ref": "#/$defs/timestamp" },
    "results": {
      "type": "object",
      "additionalProperties": false,
      "required": [
        "state_package_tests",
        "reference_resource",
        "independent_verifier",
        "any_two_recovery",
        "adversarial_matrix",
        "recovery_semantics",
        "protocol_conformance",
        "property_cases",
        "durable_quorum",
        "portable_contract",
        "coverage_percent",
        "dependency_vulnerabilities"
      ],
      "properties": {
        "state_package_tests": { "type": "object" },
        "reference_resource": { "type": "object" },
        "independent_verifier": { "type": "object" },
        "any_two_recovery": { "type": "object" },
        "adversarial_matrix": { "type": "object" },
        "recovery_semantics": { "type": "object" },
        "protocol_conformance": { "type": "object" },
        "property_cases": { "type": "object" },
        "durable_quorum": { "type": "object" },
        "portable_contract": { "type": "object" },
        "coverage_percent": { "type": "object" },
        "dependency_vulnerabilities": { "type": "object" }
      }
    },
    "known_limitations": {
      "type": "array",
      "items": { "type": "string", "minLength": 1 },
      "minItems": 5,
      "maxItems": 5,
      "uniqueItems": true
    },
    "failures": { "type": "array", "maxItems": 0 },
    "artifact_digests": {
      "type": "object",
      "additionalProperties": { "$ref": "#/$defs/digest" },
      "minProperties": 25,
      "maxProperties": 25
    },
    "review_snapshot": { "type": "string", "minLength": 1 }
  },
  "$defs": {
    "commit": { "type": "string", "pattern": "^[0-9a-f]{40}$" },
    "digest": { "type": "string", "pattern": "^sha256:[0-9a-f]{64}$" },
    "timestamp": {
      "type": "string",
      "pattern": "^\\d{4}-\\d{2}-\\d{2}T\\d{2}:\\d{2}:\\d{2}(?:\\.\\d+)?Z$"
    }
  }
}
